{
  "status": "implemented",
  "summary": "All seven plan phases completed. Fixed both off-schema .return-meta.json writer defects (ambiguous phase-field nesting across five writer/reader files, widened by the plan's own Scope Hypothesis to four additional silent artifacts-shape writers; bare-string artifacts array in the research agent). Recorded the Item C no-fallback decision in orchestrate-recover-outcome.sh's header and added a general evidence_suspect/evidence_reason detection signal covering both defect signatures. Widened the detection-escalation trigger in both skill-orchestrate and skill-orchestrate-hard so the recovered=true path (Defect 1's own scenario) can now corroborate and correct phase counts from an independent plan-file grep, with a false-positive guard verified against a genuine partial-completion plan. Every claim verified by running the real recovery script and bash -n-checked extracted orchestrator bash blocks against constructed scratch fixtures -- never by reading code alone. Deployment to .claude/ deliberately deferred per delegation constraint; no redeploy performed.",
  "phases_completed": 7,
  "phases_total": 7,
  "artifacts": [
    {
      "type": "summary",
      "path": "specs/939_return_metadata_schema_compliance/summaries/01_return-metadata-schema-compliance-summary.md",
      "summary": "Implementation summary with before/after verification table, item-B/item-C decisions, and the actual 12-file (vs. the plan's predicted 9-file) footprint reconciliation."
    }
  ],
  "blockers": [],
  "sorry_inventory": [],
  "continuation_path": null
}
