{
  "phase": "implement",
  "status": "implemented",
  "summary": "Replaced the silent dispatch_status catch-all with a three-tier structure at all three named sites (skill-orchestrate/SKILL.md Stage 5, skill-orchestrate-hard/SKILL.md mirrored Stage 5, and skill-orchestrate/SKILL.md Stage MT-4). Success arms (researched|planned|implemented) left byte-for-byte unchanged. Added a Tier B partial|failed|blocked arm that logs honestly and performs no postflight update. Added a Tier C off-schema handler (empty/null/in_progress/anything unrecognized) that emits an [OFF-SCHEMA DISPATCH STATUS - ...] stderr banner, links any produced artifact, then halts (EXIT partial in Stage 5, failed_tasks charge in MT-4). Every accept-list carries a sync comment citing context/formats/return-metadata-file.md by path, reusing the command-gate-out.sh 'keep this list and that table in sync' wording, and documents in_progress as a deliberate exclusion. Did not edit scripts/skill-base.sh (named follow-up, out of scope per the plan's Scope Decision). All 4 plan phases completed; bash -n parse checks and a stubbed-function trace-test harness confirmed the success/partial/off-schema/empty/in_progress/recovered-path behaviors before landing.",
  "artifacts": [
    {
      "type": "summary",
      "path": "specs/920_validate_dispatch_status_against_schema_enum/summaries/01_validate-dispatch-status-schema-enum-summary.md",
      "summary": "Implementation summary covering the three-site three-tier dispatch_status fix, verification evidence, and the reproduced non-functional-gaps table with the named skill-base.sh follow-up"
    }
  ],
  "blockers": [],
  "phases_completed": 4,
  "phases_total": 4,
  "plan_markers_verified": true,
  "next_action_hint": "Task complete. Named follow-up (not created by this task): admit partial and blocked into skill_postflight_update's accept-list in agent-system/extensions/core/scripts/skill-base.sh, and decide failed's disposition -- must be sequenced after task 931, which already holds skill-base.sh in its file_scope.",
  "continuation_context": null
}
